{
  "client_slug": "eduhexa",
  "display_name": "EduHexa",
  "outletId": "REPLACE_WITH_OUTLET_ID",
  "agency_name": "Hexanovate",
  "timezone": "Asia/Kolkata",
  "cadence": "daily",
  "window_days": 1,
  "brand": {
    "accent_color": "#0066FF",
    "logo_url": "https://eduhexa.in/wp-content/uploads/logo.png"
  },
  "integrations": {
    "crm": true,
    "meta": true,
    "google_ads": true,
    "whatsapp_delivery": true,
    "clarity": false,
    "spur": false
  },
  "meta_ad_account_id": "act_REPLACE",
  "google_customer_id": "0000000000",
  "alerts": {
    "min_spend_inr": 1000,
    "cpl_increase_pct": 25,
    "stale_lead_hours": 48
  },
  "delivery": {
    "email": {
      "to": ["client@example.com"],
      "cc": ["agency@hexanovate.com"],
      "reply_to": "agency@hexanovate.com"
    },
    "whatsapp": {
      "recipient_numbers": ["919876543210"],
      "template_type": "simple",
      "use_template_outside_24h": true,
      "redact_pii": false
    }
  },
  "links": {
    "crm_dashboard": "https://swayamapp.com/",
    "meta_ads_manager": "https://adsmanager.facebook.com/"
  }
}
